{
  "schemaVersion": 1,
  "subject": "resource",
  "identity": {
    "name": "clip-2"
  },
  "resource": {
    "typeCode": "RT006003",
    "title": "Codex 视频 clip-2",
    "intro": "",
    "coverImages": [],
    "tags": []
  },
  "version": {
    "version": "1.0.0",
    "filePath": "clip-2.mp4",
    "description": "",
    "runtimeVersion": null,
    "dependencies": [],
    "baseUpcastResources": [],
    "authExcludedItems": [],
    "inputAttrs": [],
    "customPropertyDescriptors": []
  },
  "policies": [],
  "collection": null
}
