{
  "schemaVersion": 1,
  "subject": "resource",
  "identity": {
    "name": "codex-e2e-template-react-theme-20260805143046"
  },
  "resource": {
    "typeCode": "RT001",
    "title": "Console Conflict Remote 20260805144132",
    "intro": "",
    "coverImages": [],
    "tags": []
  },
  "version": {
    "version": "1.0.0",
    "filePath": "dist",
    "description": "",
    "runtimeVersion": "0.5",
    "dependencies": [],
    "baseUpcastResources": [],
    "authExcludedItems": [],
    "inputAttrs": [],
    "customPropertyDescriptors": []
  },
  "policies": [],
  "collection": null
}
