{
  "schemaVersion": 1,
  "subject": "resource",
  "identity": {
    "name": "codex-e2e-photo-20260805115333"
  },
  "resource": {
    "typeCode": "RT005001",
    "title": "Codex E2E Photo 20260805115333",
    "intro": "",
    "coverImages": [],
    "tags": []
  },
  "version": {
    "version": "1.0.2",
    "filePath": "unique-photo.png",
    "description": "draft-live-D-local-20260805",
    "runtimeVersion": null,
    "dependencies": [],
    "baseUpcastResources": [],
    "authExcludedItems": [],
    "inputAttrs": [],
    "customPropertyDescriptors": []
  },
  "policies": [],
  "collection": null
}
