{
  "schemaVersion": 1,
  "subject": "resource",
  "identity": {
    "name": "e3t-1786094659560"
  },
  "resource": {
    "typeCode": "RT005001",
    "typeName": "照片",
    "title": "e3t-1786094659560",
    "intro": "",
    "coverImages": [],
    "tags": []
  },
  "version": {
    "version": "1.0.0",
    "filePath": "dist",
    "description": "",
    "runtimeVersion": null,
    "dependencies": [],
    "baseUpcastResources": [],
    "authExcludedItems": [],
    "inputAttrs": [],
    "customPropertyDescriptors": [],
    "batchSignContracts": []
  },
  "policies": [],
  "collection": null
}
