{
  "schemaVersion": 1,
  "subject": "collection",
  "identity": {
    "name": "codex-e2e-album-20260805120031"
  },
  "resource": {
    "typeCode": "RT003006",
    "title": "Codex E2E Album 20260805120031",
    "intro": "",
    "coverImages": [],
    "tags": []
  },
  "version": null,
  "policies": [],
  "collection": {
    "version": "1.0.0",
    "description": "album e2e release",
    "display": {},
    "items": [],
    "dependencies": [],
    "baseUpcastResources": [],
    "authExcludedItems": [],
    "inputAttrs": [],
    "customPropertyDescriptors": [],
    "collectRules": null
  }
}
