{
  "schemaVersion": 1,
  "subject": "resource",
  "identity": {
    "name": "codex-theme-20260804142342"
  },
  "resource": {
    "typeCode": "RT001",
    "title": "CLI Theme E2E 1786006037258",
    "intro": "CLI theme update smoke",
    "coverImages": [],
    "tags": [
      "cli",
      "theme",
      "smoke"
    ]
  },
  "version": {
    "version": "1.0.16",
    "filePath": "dist",
    "description": "theme-e2e-1786006037258",
    "runtimeVersion": "0.4",
    "dependencies": [],
    "baseUpcastResources": [],
    "authExcludedItems": [],
    "inputAttrs": [
      {
        "key": "noderuntime_target_version",
        "value": ""
      },
      {
        "key": "bundleTool",
        "value": ""
      }
    ],
    "customPropertyDescriptors": [],
    "batchSignContracts": []
  },
  "policies": [],
  "collection": null
}
